{"$schema":"https://json-schema.org/draft/2020-12/schema","title":"Atlas AI Audience Path","type":"object","required":["slug","segment","priority","risk_profile","primary_cta","route"],"properties":{"slug":{"type":"string"},"segment":{"enum":["business_professional","student","consumer_private_user"]},"priority":{"enum":["primary","secondary_controlled"]},"jobs_to_be_done":{"type":"array","items":{"type":"string"}},"risk_profile":{"type":"string"},"trust_triggers":{"type":"array","items":{"type":"string"}},"primary_cta":{"type":"string"},"route":{"type":"string"},"no_upload_notice_required":{"type":"boolean"}}}
