[
  {"slug":"business","segment":"business_professional","priority":"primary","route":"/business/","primary_cta":"Book discovery call / compare business packages","risk_profile":"Moderate to high depending on data sensitivity","trust_triggers":["security copy","local relevance","clear setup process","data-handling model","governance artifacts","support logic"],"no_upload_notice_required":true},
  {"slug":"students","segment":"student","priority":"secondary_controlled","route":"/students/","primary_cta":"Explore study package / read responsible-use guide","risk_profile":"Academic integrity, minors, privacy, reliance and hallucination","trust_triggers":["study ethics","explainability","citation support","responsible-use policy","affordability","no assignment-generation shortcuts"],"no_upload_notice_required":true},
  {"slug":"consumers","segment":"consumer_private_user","priority":"secondary_controlled","route":"/consumers/","primary_cta":"Explore personal package / start guided setup","risk_profile":"Privacy, emotional reliance, health/legal/financial boundaries","trust_triggers":["simple plan comparison","no sensitive-data collection","practical examples","privacy FAQ","clear exclusions"],"no_upload_notice_required":true}
]
